{
  "$schema": "../schemas/aurora_ace_v1_acceptance_matrix.schema.json",
  "schema_version": "1.0.0",
  "record_type": "aurora_ace_v1_acceptance_matrix",
  "engine": {
    "engine_id": "aurora_ace",
    "canonical_name": "Aurora Canon Engine",
    "implemented_through": "0.13.0",
    "acceptance_target": "1.0.0"
  },
  "authority": {
    "scope": "root_control_plane",
    "mutation_posture": "verification_only",
    "canon_effect": "none_without_authoritative_materialization_commit"
  },
  "seal_policy": {
    "required_row_status": "ready",
    "component_contracts_survive_unsealed_v1": true,
    "isolated_execution_uses_temporary_clones": true,
    "missing_environment_is_not_product_failure": true
  },
  "rows": [
    {
      "id": "ACE-V1-001",
      "title": "Retrieval precedes generation",
      "requirement": "An existing or relation-identifiable character is returned from committed CanonRec evidence without invoking generation, while an absent character continues into completion.",
      "required": true,
      "boundaries": ["CanonRec evidence", "character router", "generation fallback"],
      "execution_class": "local_safe",
      "implementation_evidence": [
        {
          "path": "tools/ace/character_retrieval.py",
          "symbols": ["build_character_index", "discover_character_candidates", "compile_existing_character_query_if_applicable", "resolve_existing_character_query"]
        },
        {"path": "tools/ace/engine.py", "symbols": ["resolve_character_query"]}
      ],
      "contract_refs": [
        "docs/AURORA_ACE__ADDENDUM__CHARACTER_RETRIEVAL__v0.4__2026-08-11.md",
        "catalog/contracts/aurora_ace_contract_v0_1.json"
      ],
      "practical": {
        "test_refs": [
          "tests/test_aurora_ace_character_retrieval.py::test_name_lookup_returns_existing_character_without_generation",
          "tests/test_aurora_ace_character_retrieval.py::test_relation_only_candidate_blocks_duplicate_generation",
          "tests/test_aurora_ace_character_retrieval.py::test_no_existing_match_allows_normal_generation_compiler"
        ],
        "dependencies": [],
        "environment": {}
      },
      "acceptance": "All three retrieval/generation routing cases pass and retain explicit provenance."
    },
    {
      "id": "ACE-V1-002",
      "title": "Constitutive character completion is replayable",
      "requirement": "A previously unrecorded character is completed through the registered naming and character-forging capabilities into a validated, commit-ready packet without being parked as unknown or staging.",
      "required": true,
      "boundaries": ["NameService", "CharForge", "CanonRec validation", "determination receipt"],
      "execution_class": "isolated_ci",
      "implementation_evidence": [
        {"path": "tools/ace/core.py", "symbols": ["compile_character_query"]},
        {"path": "tools/ace/engine.py", "symbols": ["resolve_character_query"]}
      ],
      "contract_refs": [
        "docs/AURORA_ACE__SPEC__CANON_ENGINE__v0.1__2026-08-10.md",
        "catalog/schemas/aurora_ace_determination_receipt.schema.json"
      ],
      "practical": {
        "test_refs": ["tests/test_aurora_ace.py::test_live_character_resolution_is_semantically_replayable"],
        "dependencies": ["jsonschema", "yaml"],
        "environment": {"AURORA_ACE_LIVE_TESTS": "1"}
      },
      "acceptance": "Two executions at registered repository baselines have identical semantic outputs and a complete validated packet."
    },
    {
      "id": "ACE-V1-003",
      "title": "Canonical determination semantics are complete",
      "requirement": "ACE exposes exactly the six defined determination states, treats EXECUTION_BLOCKED as operational, and never uses missing evidence or authority to park otherwise complete canon.",
      "required": true,
      "boundaries": ["canonical specification", "determination engine", "receipt schema"],
      "execution_class": "local_safe",
      "implementation_evidence": [
        {"path": "tools/ace/canon_resolution.py", "symbols": ["compile_canon_query", "resolve_canon_query"]},
        {"path": "tools/ace/core.py", "symbols": ["ACEError"]}
      ],
      "contract_refs": [
        "docs/AURORA_ACE__SPEC__CANON_ENGINE__v0.1__2026-08-10.md",
        "catalog/contracts/aurora_ace_contract_v0_1.json",
        "catalog/schemas/aurora_ace_determination_receipt.schema.json"
      ],
      "practical": {
        "test_refs": [
          "tests/test_aurora_ace_invariants.py::test_determination_vocabulary_is_defined_in_the_spec",
          "tests/test_aurora_ace_canon_resolution.py::test_retrieved_canon_returns_existing_value_without_mutation",
          "tests/test_aurora_ace_canon_resolution.py::test_derived_canon_uses_only_allowlisted_deterministic_rule",
          "tests/test_aurora_ace_canon_resolution.py::test_true_conflict_never_selects_winner",
          "tests/test_aurora_ace_canon_resolution.py::test_missing_authoritative_claim_routes_to_completion_instead_of_fake_retrieval",
          "tests/test_aurora_ace_materialization.py::test_materializer_commits_facility_and_appends_both_determinations",
          "tests/test_aurora_ace_materialization.py::test_existing_facility_target_becomes_canon_revision"
        ],
        "dependencies": [],
        "environment": {}
      },
      "acceptance": "The specification, contract, receipt schema, and reachable implementation vocabulary agree."
    },
    {
      "id": "ACE-V1-004",
      "title": "Capability discovery is manifest-derived and runtime-bound",
      "requirement": "Capability manifests are schema-valid, digest-bound, deterministic, and unable to introduce arbitrary runtime code outside the explicit binding registry.",
      "required": true,
      "boundaries": ["capability manifests", "schema validation", "runtime allowlist", "registered repositories"],
      "execution_class": "local_safe",
      "implementation_evidence": [
        {
          "path": "tools/ace/capability_discovery.py",
          "symbols": ["load_capability_manifests", "validate_capability_manifest", "build_capability_index", "select_invocation_capability"]
        },
        {"path": "tools/ace/runtime_binding.py", "symbols": ["load_runtime_binding_registry", "load_verified_runtime_binding", "resolve_verified_invocation"]}
      ],
      "contract_refs": [
        "docs/AURORA_ACE__CAPABILITY_DISCOVERY__v0.6__2026-08-12.md",
        "catalog/contracts/aurora_ace_capability_discovery_contract_v0_6.json",
        "catalog/schemas/aurora_ace_capability_manifest.schema.json",
        "catalog/ace/runtime_bindings.json"
      ],
      "practical": {
        "test_refs": [
          "tests/test_aurora_ace_capability_discovery.py::test_committed_manifest_catalog_is_valid_unique_and_deterministic",
          "tests/test_aurora_ace_capability_discovery.py::test_committed_manifests_conform_to_draft_2020_12_schema",
          "tests/test_aurora_ace_capability_discovery.py::test_manifest_metadata_cannot_create_runtime_binding"
        ],
        "dependencies": ["jsonschema"],
        "environment": {}
      },
      "acceptance": "The discovered index is deterministic and only verified binding IDs can execute."
    },
    {
      "id": "ACE-V1-005",
      "title": "Interactive, embedded, and autonomic invocation share one engine",
      "requirement": "All invocation modes produce inspectable envelopes, preserve caller and parent provenance, and route through the same manifest-backed resolver without widening specialist or authority boundaries.",
      "required": true,
      "boundaries": ["caller", "invocation envelope", "manifest router", "shared resolver"],
      "execution_class": "local_safe",
      "implementation_evidence": [
        {
          "path": "tools/ace/invocation.py",
          "symbols": ["build_invocation_envelope", "compile_character_invocation", "compile_canon_invocation", "compile_facility_invocation", "resolve_invocation", "validate_invocation_envelope"]
        }
      ],
      "contract_refs": [
        "docs/AURORA_ACE__ADDENDUM__FIRST_CLASS_INVOCATION__v0.2__2026-08-11.md",
        "catalog/contracts/aurora_ace_invocation_contract_v0_2.json",
        "catalog/schemas/aurora_ace_invocation_envelope.schema.json"
      ],
      "practical": {
        "test_refs": [
          "tests/test_aurora_ace_invocation.py::test_interactive_invocation_is_first_class_and_inspectable",
          "tests/test_aurora_ace_invocation.py::test_embedded_invocation_uses_the_same_query_engine_and_preserves_parent",
          "tests/test_aurora_ace_invocation.py::test_autonomic_invocation_is_automatic_but_never_invisible",
          "tests/test_aurora_ace_invocation.py::test_invocation_rejects_synthesis_around_specialist_tooling"
        ],
        "dependencies": [],
        "environment": {}
      },
      "acceptance": "All three modes retain identical authority and routing semantics with explicit provenance."
    },
    {
      "id": "ACE-V1-006",
      "title": "Materialization and ledgering are atomic and replay-safe",
      "requirement": "Commit-ready packets require explicit authority, materialize only through native handlers on feature branches, append pre/post determinations, and remove false canon claims after post-commit failure.",
      "required": true,
      "boundaries": ["commit-ready packet", "authority gate", "CanonRec transaction", "determination ledger"],
      "execution_class": "local_safe",
      "implementation_evidence": [
        {"path": "tools/ace/materialize.py", "symbols": ["materialize_facility_packet"]},
        {"path": "tools/ace/character_materialize.py", "symbols": ["materialize_character_packet", "materialize_packet"]},
        {"path": "tools/ace/ledger.py", "symbols": ["append_determination", "query_ledger"]}
      ],
      "contract_refs": [
        "docs/AURORA_ACE__ADDENDUM__MATERIALIZATION_LEDGER__v0.2__2026-08-11.md",